id,Title,Body,Category,Category_2,Category_3,Subcategory,Subcategory_2,Subcategory_3,SpecificDisorder,SpecificDisorder_2,SpecificDisorder_3
17310,feeling non human,"i ve had this feeling since so long.. and it wont wear off. i feel like i m just a spectator in everyones lives, not living my own. i m not an introverted person at all, i m quite extroverted. but still, i may laugh or make a silly joke. it all feels the same. i have no emotion, like i m non human. i wish i was a human. i wanna be a human. but that s not possible. i try my hardest to pretend to be one of them, but i m not. and i will never be. i will always be the spectator, the watcher, looking how they act and what is normal. but i will never be them. i have given up, i see no sense in continuing this keep up all this bullshit for what? i cannot believe that people think of me in a positive way.. i always cancel plans or show up late, if i were a human i d be a really bad one. not even able to stand up or shower, how embarrassing can one be? i have no energy left, all i do is sit in bed, work, sleep. work is draining, just two hours in feel like torture.. every day feels like hell. the hell i have to go through since i m not human. maybe it s for the better, someone like me can t be human. i don t deserve this. i will be the spectator of my own game till the end, and i cannot participante, ever.",Mood Disorders,Obsessive-Compulsive & Related Disorders,Substance-Related & Addictive Disorders,Depressive Disorders,Ocd Spectrum,Restrictive/Compensatory Disorders,Major Depressive Disorder,Schizotypal Personality Disorder,Agoraphobia
11987,panic,"long time lurker here recently diagnosed with schizotypal avoidant pd after a 2week stay at the psych ward, instigated by an absolutely incapacitating panic attack which crystallized into a mild psychotic episode. does anyone else experience recurrent panic attacks or an otherwise constant level of acute anxiety, and those who do, do you also find your perceptual disturbancespseudohallucinationsillusions intensify during an episode? ive been on fluoxetine 20mg for 4 weeks now and seroquel 25mg for a week or so but im not really sure if its helping or if its too soon to call it quits",Personality Disorders,Neurodevelopmental Disorders,Mood Disorders,Cluster A (Odd/Eccentric),Ptsd Spectrum,Cluster C (Anxious/Fearful),Schizotypal Personality Disorder,Binge-Eating Disorder,Narcolepsy
8039,night shifts with insomnia,"hey fellow insomniacs i need your take on night shifts. i will have to start working night shifts (on monthly basis, or biweekly) and at the moment ai cannot change the circumstances. i have isnomnia for years but lately i manage to sleep around 56 hours which is fine. i usually cannot sleep properly after 7am or throughout the day, as light and every single sound are interrupting my sleep. any tips on how to manage that i am scared to go to bed at 67am as i know i will hear the birds, the traffic, the kids going to school etc. my insomnia is mostly induced by anxiety and the fear of not sleeping, so it makes it worse.",Sleep Disorders,Personality Disorders,Obsessive-Compulsive & Related Disorders,Insomnia Spectrum,Cluster A (Odd/Eccentric),Ocd Spectrum,Insomnia,Obsessive-Compulsive Personality Disorder,Generalized Anxiety Disorder (Gad)
2745,dexedrine vs. adderall question,"hi all. i have been taking prescribed adderall for 4 months. i have been taking it only 2\3 times per week to avoid building tolerance. however, it still built tolerance super fast. at first, i responded to 5mg dose 2 times per day. then it stopped working only after 2 weeks so i increased it to 7.5mg 3 times per day. but after a few weeks, it stopped working again. as of now, my total dosage is around 30\40mg per day (it's split dose, 3 times per day). i'm pretty certain at this point it will stop working in near future. i never took adderall more than 3 days per week and this tolerance building speed is insane. so i'm thinking of switching to dexedrine. did any of you find dexedrine working better after going through the rapid tolerance building of adderall? any input would be greatly appreciated. thank you.",Neurodevelopmental Disorders,Obsessive-Compulsive & Related Disorders,Sleep Disorders,Adhd,Cluster B (Dramatic/Emotional),Ptsd Spectrum,Attention-Deficit/Hyperactivity Disorder (Adhd),Schizotypal Personality Disorder,Narcolepsy
21833,is this agoraphobiaanxiety?,"hi guys i'm 25m, living a healthy lifestyle and exercising every day. but i have been dealing with anxiety and panic attacks for a long time. the thing i'm obsessing over is my heart rate. four years ago, i did all the tests possible (including ecg, 24hour monitoring, blood tests, ultrasound, etc.), and they all came back great. this year i also did an extensive amount of blood tests, which all came back clear. when i'm experiencing anxiety, my heart rate reaches 150165 bpm, which throws me into a major spiral. this happens only when i'm walking outside and alone. by the way, i'm monitoring my heart rate with my apple watch. i don't have any other symptoms apart from this one. my resting hr is 70 bpm. also, when i'm exercising with weights i have no problems at all (average hr 115 bpm). when i'm doing indoor bicycle for about 30minutes again, nothing (average hr 120bpm). but when i have to go outside and walk even for a few minutes i get an average hr of 145bpm155bpm. is this just my anxiety or could it be something else? thank you",Anxiety Disorders,Schizophrenia Spectrum & Psychotic Disorders,Trauma & Stressor-Related Disorders,Phobias,Cluster C (Anxious/Fearful),Ptsd Spectrum,Agoraphobia,Binge-Eating Disorder,Alcohol Use Disorder
3092,do i have ppd?,"first of all excuse for my bad english writing abilitys but i dont seem to find anything in my own language so lets try here. i recently stopped going to therapy because of my alcohol use. my parents forced me to go. something happend while i was drunk and i ended up in the hospital because of it but i wont talk about that story here. anyway i feeled like it was sometype of conspiricy theory to humiliate me and i thought that there was nothing wrong whit me (like most alcoholics do when someone is trying to take their drink away). but in the end i ended up going. after the first visit i felt like i dont want to go there ever again because i thought that the therapist was in on the joke and they were just laughing at me behind my back. and i also thought that she must be some money hungry stranger who just wants to ruin me financially. at least i promised to try to be sober for the next weekend. and i was. for the next 11 months or so i was sober. visited once a week and everything was fine. everytime when the therapist would complement me on my sober journey i felt like ""well she is just complementing me because i pay her thats why she is doing that. at some point where i felt like maybe there is something else we need to talk about. the fucking delusional things i was thinking in my head all the time. but i always thought that it would sound so insane and embarasing that i am afraid to go to the grosery store because i am afraid that someone i know is going to see me and want to fight or kill me or something. so i just didint bring it up. i was afraid of sounding like a crazy person. it is really hard because i have really just been to work and home for the last 11 months. not really seen my friends, not gone out, no interest in finding a girlfriend nothing. because i am so afraid of someone judging me or making fun of me or just beating me up. also because my alcohol abuse before many people know me as the drunk retard. i am afraid of telling someone i got sober. i dont know why. also one time i was talking about my thinking process behind something and she just told me ""oh but we just wont be able to know what other people think without asking"" and i was like ""well yeah i guess"" but in my mind i was like you just dont understand or dont want to understand what i mean. isint that the whole point behind this personality disorder where we think we know exactly what other people think and its never good. anyway at some point the therapist started asking if i wanted to come the next week because it seemed like i have this alcohol thing under control and she was pretty sure i wont start drinking again. i told her okay lets stop and then she told me well maybe visit 2 more times and i was like sure. i was pretty sure she was just done whit me and didint want to see me ever again. the last time i was there felt kinda shit because i felt like i now its the time to tell her about this delusions i have but i was just not able to open my mouth about it. also i was really pissed off to myself about this fact. then the time was to say good bye and she asked me can i hug you and i was like yeah sure and while we were hugging she told me how proud she was of me and if something goes bad you can always call here and we can have another visit. at that point the fucking switch clicked in my head. maybe this woman actually wants to fucking help people and isn't some evil witch who is just out to steal peoples money like what was i thinking. i told her ""may god bless your kind heart in all of your future endeavors"" and walked out of the door. couple days later i still felt kinda shit because of the fact that i was not able to talk about these delusions whit anyone then i just googeled ""why am i so paranoid all the time"" and i found about this personality disorder. now i have no alcohol problem anymore but i have clear problem whit trusting people or doing anything on my free time that includes other people. should i just call back? do i need to get some test done for proof that i have this disorder. do i have to start drinking again wtf do i do.",Personality Disorders,Anxiety Disorders,Schizophrenia Spectrum & Psychotic Disorders,Cluster A (Odd/Eccentric),Adhd,Substance Use Disorders,Paranoid Personality Disorder,Bipolar 2 Disorder,Delusional Disorder
16968,empathy,"i've been learning about cognitive empathy vs affective empathy. some of the key points i've digested are empathy is situational, not dispositional people with aspd tend to have lower than average affective empathy and higher than average cognitive empathy people with no affective empathy often say things like, ""why would anyone want that? that sounds terrible and pointless."" so here are my opinions, as someone who experiences both, and is also cluster b (bpd). situational definitely checks out to some degree but it's really unpredictable and strange for me. i have been a victim of people who emotionally abused me and told lies to me and caused me all kinds of severe emotional distress and then gone on to think about their problems, and feel emotional distress over that as well. it's like being vulnerable to an emotional takeover. i once had neighbors i didn't particular know or care about, they weren't even that friendly, but when a family member of theirs died and i heard them scream and cry, i got tears in my eyes too. there have been situations where i had a lack of empathy and i think those usually involve me just being too exhausted by my own emotions. like, i got enough of mine, and i don't know you, so i don't have time for yours. this is often how i feel about homeless people or people who have survived natural disasters. but then there's usually a slight sense of guilt for thinking i should feel empathy towards them. but i dont know. my empathy is precious and i will be stingy with it when at all possible. in terms of my own empathy vs average, i can qualify, not quantify, i guess. i believe a large part of affective empathy can be delusionfantasy. like, unless you're psychic, you really don't know for sure what another person is feeling. but when i think i know what they are feeling, i feel that way too. obviously there are situations where a normal response might be, ""i can't even imagine the pain..."" but weirdly enough when i really get into some topics like, watching a mother grieve the loss of her child, watching children suffer as their country is torn apart by war, watching someone try to hold it all together as they experience destitute poverty, i feel as though i start to understand what they are going through, vicariously, even though i've never been in that situation. it may not be apples for apples. it's not literally knowing what it feels like you cannot substitute imagination for reality. but it's also not just being able to brush it off because it's completely unrelatable. in a way, we've all lost something at some point. we've lost people who mattered to us, we've lost parts of ourselves, we've experienced irreversible changes that made up very upset. so it's like i'm regurgitating emotions i've previously felt for different reasons and layering them over the stories i'm learning from others' lives. why would anyone want to feel this way? well, you can definitely go overboard with it. there are times when i've wanted my empathy to take a break and it wouldn't. there have been times when i was in abusive relationships and the person did not deserve my empathy. i sometimes don't seem to have a selfprotect mechanism against empathy that could lead to stupid decisions. i think people with bpd can be very selfcentered, but that doesn't always translate to selfprotection. i would venture to say people with aspd are instinctively and consistently selfprotective and that is part of the reason their brains automatically shuts out empathy that would cause them personal suffering. so i can understand why they would say, ""ain't nobody got time for that."" when i'm around a person with npd or possibly aspd i wonder if my empathy would even annoy them sometimes they might assume i'm just faking it. they might think of the times they had to mirror and fake emotions and assume i'm doing the same to them. i also sense that there's like a wall of concrete around them. they long for closeness but have also sort of (or completely) given up on it. completely taken over by a cynical, hopeless perspective on connection. so even when i physically touch them, it's like their mind is is another room. i think this could be another one of my projections, because i also feel like when i'm with people i'm not really with them. but sometimes i wish i could just talk a person out of feeling so alone. like, ""you feel alone, and i feel alone, but actually we're together right now, you don't have to feel that way, please."" i'd like to know your thoughts and kind of compare these emotions and experiences if a lot of this sounds completely foreign and far out, or if it doesn't.",Personality Disorders,Sleep Disorders,Neurodevelopmental Disorders,Cluster B (Dramatic/Emotional),Substance Use Disorders,Bipolar Disorders,Antisocial Personality Disorder,Attention-Deficit/Hyperactivity Disorder (Adhd),Adjustment Disorder
15418,constant highs and lows,"hello, i hope everyone is having a beautiful day or night i wanted to share kind of a lengthy post where i m talking so ignore some of the weird text slang coming through because of that. but i wanted to start out with the fact that i have been extremely in the middle of a huge transformation, spiritually dealing with extreme bouts of channeling energies feelings, emotions, sounds ,messages ,songs ,memories in child work, shadow work subconscious ,dream work , reriwiring old loops patterns accepting my feelings as they come learning to be authentic learning to get rid of my guilt my shame not letting anyone own my thoughts not feeling like i have to make other people feel my pain or feel understood or not choosing the pain, but choosing the joy of the present and the people that i m with seeing them for who they are and accepting them these are all the thoughts that go to counteract my constant thoughts of putting people through a whole deduction process in order to learn their soul if i can trust them and seeing that i m constantly let down by expecting romantic connections with men and immediately making things like this is the person for me, maybe and just going into extreme delusions and fantasies and illusions and just put all my energy and thought process on one person. this is gone on since high school where i ve wanted to savior and have wanted that person. i found a significant other and had that relationship and never got over it since it s been like six years and i m just now learning that i wanted that person to feel my pain or somehow realize that they regret losing me, and i have to realize that i don t lose people. people don t lose me. i was chosen and i am special and i am loved and chosen every day by god and myself and i need to learn how to have selfworth so i don t idolize new people. i meet getting obsessed with them thinking that i need to lower myself for them and just go along with something i maybe don t deserve. i can t even handle relationship obviously i m still having mental illness and issues so i need to just be alone and let go of all my old past connections that i string along with the hopes and desires of maybe being chosen and of course, i would hate on myself for this feeling because, the world calls it pick me or just doesn t see how it s wrapped up in a cycle of neglect rejection abuse abandonment i want to heal this version of myself that was hurt by the world and just still only spread love to myself and just be myself and not let anyone own me and learn how to feel my feelings and face my addiction substance use orders i can learn to sit with myself without the distractions of my phone scrolling people just full my day with positivity.",Mood Disorders,Eating Disorders,Neurodevelopmental Disorders,Bipolar Disorders,Generalized Anxiety Disorder,Phobias,Bipolar 1 Disorder,Major Depressive Disorder,Adjustment Disorder
22434,just stop me from eating,"i feel like the only way to stop me from bp is just to have no food available. i m good if i restrict but as soon as i eat anything i binge on it and then binge on more because i have wasted the day anyway. it s gotten to the point that i have binged every day for a year and a half, where the longest i lasted without bp is half a day, and then i had one banana, and ended up binging again. i am just incapable of being normal. i wish i could change. i ve got desensitised stomach muscles and can t get everything out till empty anymore and i ve gained weight and destroyed my teeth and i hate this. i just want to develop at least some discipline. some self restraint and even some self respect to stop doing this to myself. i know the way to stop this is to stop binging but i don t know how to.",Eating Disorders,Trauma & Stressor-Related Disorders,Personality Disorders,Restrictive/Compensatory Disorders,Depressive Disorders,Cluster A (Odd/Eccentric),Bulimia Nervosa,Schizophrenia,Cyclothymic Disorder
10049,being unable to enjoy fun activities,"sledding. ok, i slid down the hill. that's it? swimming. alright, i'm moving about in a large fluid. why is this supposed to be fun? bowlingmini golf. get the ball into the goal. too simple an idea, but frustrating more than it is fun. and so, so many other things. i feel like i'm a damper when people say they want to do these things, so i bear through it with a smile even though i hate it. the only thing i might enjoy at a pool or water park is the water slides. is this overanalyzation causing boredom a part of adhd? like, ""i get it, moving on now.""",Neurodevelopmental Disorders,Sleep Disorders,Schizophrenia Spectrum & Psychotic Disorders,Adhd,Restrictive/Compensatory Disorders,Ocd Spectrum,Attention-Deficit/Hyperactivity Disorder (Adhd),Agoraphobia,Restless Legs Syndrome
11510,my bf doesn t understand.,"i have generalized anxiety disorder and panic disorder. i have been talking about my disorders and attacks with my boyfriend since i feel my attacks may be increasing. i explain to him that there doesn t need to be a trigger for my attacks to happen, i will just be peacefully working and boom it hits me. he really tries to understand it but every time we talk about it he says stuff like there has to be some kind of trigger and i just don t dwell on that stuff . (that stuff being the childhood trauma that led to these disorders.) no matter how many times i explain to him there is no trigger and i m not dwelling on it he struggles to comprehend how anyone could have a panic attack for no reason. i really just want to be able to put it into words he will understand. i want to be able to confide in him about it without feeling like i have to have this elaborate explanation every time. is there anyone else who has dealt with a similar situation that can give me some advice?",Anxiety Disorders,Obsessive-Compulsive & Related Disorders,Eating Disorders,Panic Disorders,Insomnia Spectrum,Depressive Disorders,Panic Disorder,Agoraphobia,Cyclothymic Disorder
15111,changing faces of family.,"does anyone ever see subtle changes in how their family members look? i'm not talking major changes, just tiny changes that make you immediately question whether they are your family member. i get this now and again, and it's horrifying and distressing. how do you reality test for something that doesn't look exactly like them? reality is skewed. i also, sometimes, don't recognise my own face in the mirror. to the point i hate looking in the mirror. i refuse to unless i'm feeling particularly brave one time, my reflection was that of a very old man (like 100 years old). it's terrifying. anyone else get this?",Schizophrenia Spectrum & Psychotic Disorders,Anxiety Disorders,Substance-Related & Addictive Disorders,Psychotic Disorders,Insomnia Spectrum,Cluster B (Dramatic/Emotional),Schizophrenia,Cyclothymic Disorder,Antisocial Personality Disorder
394,a diagnosis,"finally. the event in question happened about 2 years ago now, but i live in a world where it only just happened. no time has passed. i live in a world of fear and triggers, sleepless nights and nightmares when sleep does occur. for some reason, i thought having a proper diagnosis would make me feel better somehow. i mean, it's validating. i have better language to explain when i just can't show up... so there's that. being someone who has had a form of ptsd for my whole life, with a recent event making it far worse, almost unmanageable, i know how i've been received by the outside world, it makes each and every symptom worse, because of how isolated it makes me(us all.) if this were a diagnosis of something physical, even nonlife threatening, there is societal permission to talk openly about struggles with symptoms. if it's a mental struggle, nope. absolutely not. not without making everyone uncomfortable. if you cancel plans or struggle to keep them due to this illness, eye rolls, judgement, accusations of lies(ok that's fair. i've lied plenty in order to hide from triggers, pain and judgement) ... but if this were physical, there would be no need for lies. there would be quick understanding from most... i was robbed of my ability to 'be normal ' very young, in a variety of ways. my life has added up to a very selfish existence, as you must be rather selfish to stay alive, when every day you can't shake the feeling of being watched... or an impending doom... i'm grateful for this group, how validating all by itself. all events that happened to us are different, but link is to this community. it's not a community i'd ever wanted an invitation to, but i thank all those who have been kind. stay strong, soldiers. keep fighting. that's our job now. every day, we must fight, simply sometimes to just show up at the baby shower.",Trauma & Stressor-Related Disorders,Eating Disorders,Schizophrenia Spectrum & Psychotic Disorders,Ptsd Spectrum,Autism Spectrum Disorders,Adhd,Post-Traumatic Stress Disorder (Ptsd),Sleep Apnea,Delusional Disorder
3010,distinguishing mania from being in a good moodhyper,"does anyone have any tips for this? my boyfriend can usually tell and points it out but i want to figure it out for myself as well so i don t make poor decisions and do bad things. i know when i miss my paliperidone and get like that it s a manic episode, but occasionally they will happen out of the blue and i ll need to take seroquel to calm it. but how do i know if i m just in a good mood and hyper? this is such a struggle. how do you guys tell?",Mood Disorders,Sleep Disorders,Anxiety Disorders,Bipolar Disorders,Adhd,Psychotic Disorders,Cyclothymic Disorder,Dependent Personality Disorder,Avoidant Personality Disorder
