id,Title,Body,Category,Category_2,Category_3,Subcategory,Subcategory_2,Subcategory_3,SpecificDisorder,SpecificDisorder_2,SpecificDisorder_3
19802,i don't know if it's ocd or the holy spirit,"so i'm religious obviously lol, and i've been having this issue that i just can't shake. so if you are also christian, please help me with this one if you can. everyone with ocd knows the horrors of gut feelings, and a lot of the time, christians are told to trust these gut feelings because they are the holy ghost trying to tell you something. but i cannot for the life of me tell if some feelings are ocd or actually the holy spirit. i'm scared that they are the holy spirit but i'll think they are ocd and i'll miss something important, or vice versa. also, i really struggle with regret along with this, like i'm scared i'll regret something, but i don't know if this fear is real or just ocd. can anyone help or relate to this? thanks",Obsessive-Compulsive & Related Disorders,Eating Disorders,Schizophrenia Spectrum & Psychotic Disorders,Ocd Spectrum,Ptsd Spectrum,Insomnia Spectrum,Obsessive-Compulsive Disorder,Hoarding Disorder,Schizotypal Personality Disorder
19564,i cant stop binging even when i eat clean and high protein,"i am currently again in a phase of binging and night eating...and around 1.5months ago i stopped buying processed food, prepped meals, junk food etc. i still buy myself something sweet occasionally but it never ends well and i need to finish the entire bagbar. i realized that despite eating high protein, lots of veggies and newly discovered skyr with adding some chunjy flavor (when i crave nutella, i add hazelnut etc)...i still overeat. i am nit hungry at all, i am in pain for eating so much volume and yet...i cant stop myself. i know i eat because of emotional reasons but i still hoped it will be better if i avoid junk food. weight is still going up. my motivation barely there. should i try glp1? i have been fighting my weight for over 20yeara now...i am tired",Eating Disorders,Anxiety Disorders,Mood Disorders,Restrictive/Compensatory Disorders,Cluster A (Odd/Eccentric),Ocd Spectrum,Binge-Eating Disorder,Narcissistic Personality Disorder,Autism Spectrum Disorder (Asd)
18993,have you ever lost good opportunities bc of your social anxiety,"college has always been a struggle for me, i would consider myself a drop out. whenever things get too stressful for me i just shut down and start avoiding everyone. i ve been working on ways to improve my social anxiety bit by bit and now i have a new opportunity to change my life but i m afraid that i ll fall into old habits. sometimes i regret not using the time i had out of college to go to therapy. i feel like i m at a loss when i m alone has anyone gone through anything similar? or has anyone gotten anything positive after taking on a new opportunity?",Anxiety Disorders,Personality Disorders,Mood Disorders,Phobias,Autism Spectrum Disorders,Depressive Disorders,Social Anxiety Disorder,Adjustment Disorder,Obsessive-Compulsive Disorder
8965,struggling at work,"i really need advice. on a throwaway so i dont dox myself i was diagnosed with asd, specifically aspergers when i was almost 19. i have always felt different and made it clear to my parents but as traditional tiger parents, nothing is wrong with you . maybe i still hold resentment. my entire life i pushed through on hope. in elementary school it was i hope middle school is different and i wont feel so different and have friends etc. now it became well i hope working is better than college. news flash, work has made me even more depressed. i am 23, graduated at 21 with my masters degree. i have been working since then. i am coming up on 2 years of work and i feel more lost than ever. at work, i feel afraid of all my coworkers. i am the lowest level employee by a long shot at my company. some have straight up yelled at me or others on calls but some have been nice but have made snide remarks when i make mistakes, etc. for context, by numbers, i am a 4 and they are all 1s and 2s, so much more senior than me which certainly plays a role in my fear. now i just assume all my work is shit and that im wrong and if they press me asking why i did something i just say its wrong (even if its right) and the pressure causes me to make more mistakes. the work i do is fairly manual and it is really uninspiring. i dont get to use almost any of the skills i developed in school and in general it feels like i just get thrown the busy work that no one else wants to do (people much higher than me) i dont have a connection to it and it makes it really hard for me to focus on it. i was a high achiever in school, deans list, top 10% of my class etc but in the workplace none of those skills seem to be translating because there are no exams and everything relies way more on being social and good at communication. i have a few hobbies i enjoy, but they arent cheap. i like working on my car and driving it. this was one of my hyperfocuses since i was maybe 13 or 14 and i learned what a manual transmission was. i bought a performance car and i am glad i did so no matter what it costs. right now it is my hope keeping me going. i will take off work slightly early on bad days just to get in my car and hear the noises it makes as it can make me feel slightly better. i still save a huge chunk of my gross and have a lot of money saved up for emergencies. i guess this all comes down to, what is the point of life if i have to spend 33% sleeping, 45% at work and i only get such a small bit of time to focus on my hobbies? it just feels like im living just to suffer for the few hours a day i get to drive or the few hours on a weekend when i can afford a part to tinker on my car. i have almost no motivation to do anything outside of this. sometimes just geetting out of bed and going to work is tough.",Neurodevelopmental Disorders,Eating Disorders,Sleep Disorders,Autism Spectrum Disorders,Cluster A (Odd/Eccentric),Phobias,Autism Spectrum Disorder (Asd),Hoarding Disorder,Schizoid Personality Disorder
1063,"always helps, but now, helpless","i ve always been the type of person who helps others, independent and of strong personality. however, when i decided to pursue further studies while working, things got worse. i found it difficult to choose between work and school, when in reality, i am not privileged enough to pursue both. to be honest, even if my finances were no longer enough, i found it difficult to transfer workplaces, i thought my current workplace is too lenient for allowing me to study after working hours inflation, etc. bottomline, i ve maxed out all of my credit cards, i explored loaning from online lending apps, all of which are now past due. worst, i got physically sick, until last year, while i never thought i ll experience panic attacks ever, i did this required medication which of course has costs on my end. with all the costs keep piling up, i tried to ignore at first until i asked help from friends and family who i previously helped. unfortunately, no one was willing to help. i tried going thru therapy but it has costs too. the collection agencies keep bothering me, and the thought of having no one to seek help from saddens me. now, aside from panic attacks, i already think if it s better if i will be gone for good. i know i shouldnt expect for any return but it is still disappointing. what if my now bad credit history will hinder me from getting jobs with better pay? what will i do now that i am being asked by my company to resign? it s draining to be alone. my problem may not be that serious to others but i just really can t face it anymore. ( just wanted to vent out while trying to manage depression which i keep from the people that i love.",Mood Disorders,Trauma & Stressor-Related Disorders,Substance-Related & Addictive Disorders,Depressive Disorders,Adhd,Cluster C (Anxious/Fearful),Major Depressive Disorder,Restless Legs Syndrome,Narcolepsy
3845,honestly i don't know anymore,"my dad told me my eating disorder is not a problem because to him it won't ""kill me"" and then proceeds to tell me to just go on a diet and have selfcontrol well i know it was probably because he does not know much about eating disorders but i did tried to explain it to him but he just gave me a ""back in my day we don't have that blablabla"" all i wanted was help but now i think they don't care unless if im so close from dying from it my mom also said this too but she still tried to comfort me a little bit.",Eating Disorders,Anxiety Disorders,Personality Disorders,Restrictive/Compensatory Disorders,Cluster C (Anxious/Fearful),Phobias,Bulimia Nervosa,Restless Legs Syndrome,Schizoid Personality Disorder
20910,i m an adult living with parents and tired of feeling this.,"to expand on the title. i m a 20something going on 30 adult, i live with my parents, long story short they are letting me live with them rent free while i pay off debt. in the meantime, i pay my own bills, i make my own financial decisions. sometime before christmas i decided to get myself another credit card, one of my parents opened it from the mail thinking it was theirs, they flipped out. fast forward to now, i decided to get my own po box (without their knowledge) so my mail can be stored separately from theirs so they don t ask questions. i love them and i know they just want to help but they don t know when to just step back and let me do my own thing. if i get myself into credit card debt, then i will get myself out. i can t have them asking me about these things. i don t have any other choice right now financially but to continue living with them. why can t i shake this feeling that they will still find out somehow? i just want a little independence. this should be a good feeling not a paranoidguilty one. i m not doing anything bad. i keep telling myself this too. this is an adult decision that i don t have to disclose to anyone because it is my business. edit boundaries are healthy and i should be proud of myself for standing up for myself and laying down boundaries that should have been set a long time ago anyone else having similar feelings?",Personality Disorders,Eating Disorders,Sleep Disorders,Cluster A (Odd/Eccentric),Phobias,Autism Spectrum Disorders,Paranoid Personality Disorder,Generalized Anxiety Disorder (Gad),Adjustment Disorder
15611,currently having panic attack(heath anxiety),i have very very bad health anxiety and have had an irritated daith piercing for the last year. two days ago i finally decided to go to the piercer and get the jewlery switched to see if it would help. it has been extremely painful swollen and oozy(i can t tell if it s just blood mixed with normal piercing crust or if it s infected) and now im having a panic attack 100% believing it s infected and im going to die of sepsis. my piercer can t see me for another few days and i feel stupid going to the doctor abt this. i also rlly dont want to take antibiotics bc i have emetaphobia and they ve always made me rlly sick and im just spiraling rn its 5 am and i need to sleep and im worrying myself sick even tho i went through this with another piercing and it was fine after cleaning it well it just feels different this time ugh,Anxiety Disorders,Eating Disorders,Sleep Disorders,Panic Disorders,Generalized Anxiety Disorder,Phobias,Panic Disorder,Bulimia Nervosa,Dependent Personality Disorder
13807,sad getting worse with age,"my sad is getting worse with each year, and i don t understand why. i ve had it since i was a teenager, just after my family moved to upstate new york. all my doctors and therapists have told me that for most people sad lessens in severity as you get older. i m 37 now, and this is by far the worst year i ve experienced. i am back on wellbutrin xl, still the firstline therapy for sad. but this year all i m getting is the usual increase in blood pressure and anxiety and zero neurochemical balance. i am barely functional and am noticeably worse despite my life being in a better place than it s ever been. my husband and son are both understanding and supportive, but i can see their sadness in being forced to deal with my changes in personality. it s like i m a whole different person every fall, but this time nothing is working and pushing myself to accomplish anything is the most monumental task. is anyone else out there experiencing worsening sad with age?",Mood Disorders,Personality Disorders,Anxiety Disorders,Depressive Disorders,Panic Disorders,Autism Spectrum Disorders,Seasonal Affective Disorder,Paranoid Personality Disorder,Agoraphobia
4394,how do you control your rage?,"self explanatory, this is something im working on, so far walking away to collect myself works wonders going for a walk or run too, but you know how it is the instant rage that builds up suddenly. what are some coping skills you've tried that has worked? also is there anyone who has bipolar and borderline? i lowkey believe strongly im more borderline than bipolar but that is to be seen from my doctor. so far just bipolar 2.",Mood Disorders,Sleep Disorders,Substance-Related & Addictive Disorders,Bipolar Disorders,Psychotic Disorders,Cluster A (Odd/Eccentric),Bipolar 2 Disorder,Cyclothymic Disorder,Bipolar 1 Disorder
3628,"help, meds not working","hi i recently got diagnosed with adhd, and we started me on some medication, we started with five mgs of amphetamine, then we went up to ten i haven t felt a difference, it would be pushing if to say i have been more chill my brother was on this, and it worked for him could it be because i am actually still struggling with the lack of motivation from depression? i feel like i can t sit and do anything. please help i am desperate",Neurodevelopmental Disorders,Mood Disorders,Anxiety Disorders,Adhd,Psychotic Disorders,Cluster B (Dramatic/Emotional),Attention-Deficit/Hyperactivity Disorder (Adhd),Adjustment Disorder,Obsessive-Compulsive Personality Disorder
11452,mustering up the courage to speak my mind at work,"i hate confrontation. i am a people pleaser. and i am not pleased at work with how i have been treated lately. kinda feels like theres a target on my back bc the last few weeks have been like rough with my supervisor and i believe i am an incredibly hard worker. when im home and ranting i play out scenarios where i tell my boss exactly how im feeling but know i cant do it in real life. i knooooow i need to speak my mind or im gonna burst but legit dk how to just get past it. i feel like ill embarrass myself and quiver, turn red or cry sticking up for myself",Anxiety Disorders,Sleep Disorders,Personality Disorders,Phobias,Psychotic Disorders,Depressive Disorders,Social Anxiety Disorder,Adjustment Disorder,Paranoid Personality Disorder
14246,sexual side effects from prozac and lamotragine,i ve tried both doses of wellbutrin and they have done nothing. i have an appointment with my psychiatrist next week and she even told me to bring some ideas so we can figure this out. what is something that helped your non existent sex drive from prozac and lamotragine. i really don t want to stop these meds because they work wonders for me but i will if i can t have sex anymore without feeling numb and repulsed. please help me.,Anxiety Disorders,Sleep Disorders,Neurodevelopmental Disorders,Generalized Anxiety Disorder,Psychotic Disorders,Ptsd Spectrum,Generalized Anxiety Disorder (Gad),Alcohol Use Disorder,Agoraphobia
10217,bipolar awareness day was yesterday. what totally normal bipolar stuff were you up to?,"i just saw someone mention yesterday was bipolar awareness day (330) and thought damn i missed it. then i realized i spent 5 hours sitting at my desk making a website (for a new business, of course) without eating or drinking or getting up. i guess i didn t miss it. i also told a support group that i can t tell if i m chasing a philosophical inquiry or delusional the more absorbed i get in wondering if this existence is real vs if nonexistence is more real. so that s fun. didn t think that through before tossing it out there while also sharing that i don t want to take my meds. yay, happy bipolar awareness day i think i nailed it. you?",Mood Disorders,Anxiety Disorders,Schizophrenia Spectrum & Psychotic Disorders,Bipolar Disorders,Adhd,Cluster B (Dramatic/Emotional),Bipolar 2 Disorder,Schizoid Personality Disorder,Histrionic Personality Disorder
7295,is it possible i could still be diagnosed with narcolepsy?,"i had my mslt today and i'm not feeling very great about it. i get my results thursday but, from what i've read, it doesn't sound like i'm going to get a diagnosis. basically, my overnight study went fine, it took me an hour to fall asleep but that's pretty typical at night. my sleepiness is moreso during the day. for the daytime testing, it started out good. for the first two naps i fell asleep quickly, within a couple minutes. i also experienced hypnopompic hallucinations during my second nap, i don't know if that will matter. but for the last 3 naps i couldn't sleep at all. the person doing my study confirmed each time whether i slept or not so i know this to be true. she said i was very close to sleeping all 3 final naps, but i just didn't. i was way too anxious during the naps about possibly messing up the test, it's all i could think about and it kept me up. after we were all done, she was telling me about some paid studies i could enroll in if i do get a diagnosis of narcolepsy, but that was weird to me bc i was so sure at that point i wouldn't get diagnosed. i know she's not the doctor and maybe she has no clue whether my results mean diagnosis or not, but i thought that was interesting. i'm a little unclear about the diagnostic process from everything i've read, but i know it's possible i entered rem sleep quickly in my first two naps. and i also know that the mslt isn't the only deciding factor in a diagnosis. but is it really possible to get a diagnosis of narcolepsy with only two successful naps?",Sleep Disorders,Schizophrenia Spectrum & Psychotic Disorders,Trauma & Stressor-Related Disorders,Insomnia Spectrum,Cluster C (Anxious/Fearful),Depressive Disorders,Narcolepsy,Seasonal Affective Disorder,Schizoaffective Disorder
21912,is this normal?,"tw sui attempt i was diagnosed with pdd as i wanted to fix my sleep schedule and i was having a lot of low mood etc etc around nov 2024. from the first session i got the medication ( lorazepam 1mg ecstilolpram 5mg) i have to take both of the medication every day every night. i was really tired for the first two weeks. i dont have any appetite to eat. and then i broke up with my bf (now ex) as i was expecting he to like atleast check up on me, like did i eat today. but he was quiet and yeah. i think few days after that i was really impulsive as i call my friend and i told him everything. i ate 15 mg of lorazepam. but it happened without being planned. so i asked my friend to bring me to hospital(27122024) and i was doing great until i did overdosing on remaining escitalopram that i found yesterday, which is 45 mg(impulsive). please bear in mind that i was only weight 40 kg and 149 cm. i was too scared to go to the hospital so i went to clinic. they said they cant help me, so now i am hoping for the best. my symptoms are getting better, which is nice",Mood Disorders,Trauma & Stressor-Related Disorders,Anxiety Disorders,Depressive Disorders,Bipolar Disorders,Adhd,Persistent Depressive Disorder (Dysthymia),Schizotypal Personality Disorder,Bulimia Nervosa
18231,got hired as a first reader for the coloured lens,it's a magazine that offers personalised feedback on all submissions. i'll be voting on stories and giving personalised feedback it's unpaid but a job is a job and i'm happy. i couldn't complete school due to cognitive issues (now mostly fixed with abilify) so i'm very happy to be in a state where i can have a job now.,Schizophrenia Spectrum & Psychotic Disorders,Mood Disorders,Personality Disorders,Psychotic Disorders,Substance Use Disorders,Autism Spectrum Disorders,Schizophrenia,Obsessive-Compulsive Personality Disorder,Cyclothymic Disorder
22042,it is hard but i am trying.,"got diagnosed with dysthymia recently. it's a bit of relief as at least now i understand why i have been feeling this way for so long. i've been struggling with my mental health for a while now, and it's become increasingly difficult to manage anything. i feel so hopeless and sad for some unknown reason continuously. it's exhausting, and no matter how hard i try, i can't seem to shake it off. and parents not being understanding makes the situation worse. the relationship with my partner is also effed up. i have also imagined ending everything, maybe it would be much easier. i know it's wrong to end your life but sometimes i just can't stop thinking about it. i just want to feel normal again. i hope i feel happy again because being this way is hard.",Mood Disorders,Anxiety Disorders,Neurodevelopmental Disorders,Depressive Disorders,Restrictive/Compensatory Disorders,Panic Disorders,Persistent Depressive Disorder (Dysthymia),Seasonal Affective Disorder,Post-Traumatic Stress Disorder (Ptsd)
861,advise on getting caught,"16m been caught about 4 times now all from my room being searched weed has been one of the only things keeping me sane and keeping me on school never have i let it affect my schooling or such. my parents are very anti weed and view it as a drug that should not be used at all no matter what. weed is illegal where i live ( australia ) i'm being forced to go to various consulting meetings and such for my ""drug addiction"" need some advice from others who are or where once in the same situation as me. thanks guys",Substance-Related & Addictive Disorders,Sleep Disorders,Personality Disorders,Substance Use Disorders,Cluster C (Anxious/Fearful),Generalized Anxiety Disorder,Cannabis Use Disorder,Persistent Depressive Disorder (Dysthymia),Histrionic Personality Disorder
856,advicerant? re cyclothymia adhd,"posted in radhdwomen also so i was diagnosed with mild combination type adhd and cyclothymia (mild bipolar disorder) this year and i'm currently taking 20mg of latuda. the psychiatric nurse practitioner who prescribed it to me had a theory that my inability to complete my tasks or focus was linked to my mood swings and while i thought that was a valid theory, i still am not satisfied with my medication journey. my mood is pretty stable now, except for the now rare outbursts of anger (like i have a higher threshold and its easier to manage) while it has been a bit easier to quiet my brain down enough to focus i'm still finding it hard to work efficiently and remember things. it's like i can get through a task, but the entire time im trying to focus on the steps to get it done i still have a million things running through my brain and something as simple as adding a client's information to a letter template and printing the envelope for said letter is taking me half an hour...all im doing is copying and pasting....it shouldnt take me that long. has anyone else with adhd and cyclothymia or bipolar had to struggle with this, and what was your experience? what medication combinations have you found that work? did you work with a nurse practitioner or speak with a psychiatrist?",Mood Disorders,Schizophrenia Spectrum & Psychotic Disorders,Obsessive-Compulsive & Related Disorders,Bipolar Disorders,Psychotic Disorders,Adhd,Cyclothymic Disorder,Restless Legs Syndrome,Delusional Disorder
20558,i have a relative who is a hoarder and i want to help her unhoard,"i want to help her unhoard, but i don't know how. her bedroom has become a fire trap as she can barely get in and out. she refuses to go through her things and assess what can be donated or given away. there are no more closets in the house. she has 6 closets, 5 long dressers, 2 custom closets everything is full. most she hasn't touched in 15 20 years. the old dining room is piled from floor to nearly ceiling with packed bins of clothes that she hasn't touched. it's not even functional, because every room is filled with her stuff that she doesn't touch, wear or use. i don't mean for this to be tmi, but a rat got into her home and died in the midst of her piles of clothes. is there a healthy way to help her unhoard? she is never going to through any of her things. i don't know how to get through to her without her screaming and becoming enraged.",Obsessive-Compulsive & Related Disorders,Personality Disorders,Eating Disorders,Ocd Spectrum,Phobias,Ptsd Spectrum,Hoarding Disorder,Sleep Apnea,Alcohol Use Disorder
