id,Title,Body,Category,Category_2,Category_3,Subcategory,Subcategory_2,Subcategory_3,SpecificDisorder,SpecificDisorder_2,SpecificDisorder_3
22686,lf advice,"hi, im a 17yo female. im undiagnosed. im a freshman at college and im on campus. i have a roommate. im undeclared. i have been in therapy on and off my entire life for things but they were trauma and depression focused and ive had hallucinations on and off and paranoia and psychotic symptoms on and off since about 10. i finally was able to begin therapy here, at my college, covered fully. i am also seeing a psychiatrist to discuss diagnosis and whether she reccommends meds for my paranoia. backstory aside i feel worse recently. i think its a combination of living w people (constant dull noise, my fridge, no silence, i feel like when people talk they are the noise level equivalency of being in my room) of stress and of considering my symptoms and why im in therapy more. i struggle a lot believing myself. i would describe it as the mental situation of folding a cloth over and over on itself. i believe, partially, that im lying about everything and ive been doing it so long i believe myself now it makes me wonder if that is why i feel worse when i think about my symptomsthat i am causing them and therefore they only occur through conscious thought, like, i will them to happen sort of. but i dont think that, really. i have been confirmed to have had a psychotic episode in the past (the psychiatrist im meeting with confirmed that) and i know i do hallucinate (infrequently) and i am paranoid. i am just feeling wors elately and i worry once a week therapy is making me anxious and stressed. not because of the therapy itself but because of everything around it i guess. i am sort of a mess and have had to correct my thoughts so im not going off into tangents multiple times writing this lol. to conclude my question, i guess, is do others feel this way ( that thinking of and dwelling on, ig, or examining their symptoms worsens them. if so what do you do, what can i do? i also worry talking in therapy isnt helping. i am not eager to get on meds but i feel sick physically mentally all the time recently it seems. i don't like tabling this weekly after our sessions because it is not possible to table and it is causing me what i would consider to be distress. thank you so sorry if this post is not easy to read i apologize i appreciatr any helpthoughts.",Personality Disorders,Anxiety Disorders,Trauma & Stressor-Related Disorders,Cluster A (Odd/Eccentric),Phobias,Autism Spectrum Disorders,Schizotypal Personality Disorder,Insomnia,Anorexia Nervosa
4652,how do you not let anxiety take over?,"hello i m a m24 and i struggle with anxiety pretty badly i also a panic disorder but idk how to not let anxiety ruin things for me like i find it difficult to get a job, drive or just have a peaceful day without having a panic attack or worrying about every little thing sometimes what i worry about doesn t even make sense. i really struggle with sleeping like to the point where i will start having a panic attack because i have nothing to distract me. i also struggle with social anxiety and it s the worst i can t even talk to people or be around people without feeling uncomfortable sometimes it also causes me to have mini panic attacks where i will start sweating really badly and shaking i just always think something bad will happen idk why. i m on medication for my anxiety and panic attacks but it helps very little.",Anxiety Disorders,Substance-Related & Addictive Disorders,Sleep Disorders,Generalized Anxiety Disorder,Ocd Spectrum,Cluster B (Dramatic/Emotional),Generalized Anxiety Disorder (Gad),Alcohol Use Disorder,Autism Spectrum Disorder (Asd)
5126,how to deal with the stomach ache of a binge,"i just ate something really sweet my mum made for me and today i honestly binged so much, all i can think ab is how much weight ive just put on honestly this dessert thing feels like the last straw and i always start feeling really sick when i eat something im afraid of. im resisting the urge to go workout or purge esp since im at home right now and if i purge someone will absolutely find out but it s starting to feel like my only option",Eating Disorders,Obsessive-Compulsive & Related Disorders,Mood Disorders,Restrictive/Compensatory Disorders,Adhd,Generalized Anxiety Disorder,Bulimia Nervosa,Agoraphobia,Generalized Anxiety Disorder (Gad)
19135,hypomania and depression both lead to the same behaviors.,"when i m hypomanic, i engage in harmfulstupid behavior because i feel amazing, i just want to party, have a good time, and not give a fuck. when i m depressed (which is much more often), i engage in harmfulstupid behavior because i m angry with myself, i can t stand myself, i just don t want to think about my life and i need to take my mind off it. different emotions, but the behaviors and outcomes stemming from them are the same. this has always been my problem. even on meds, the behaviors don t completely go away, they re just less harmful and impulsive.",Mood Disorders,Eating Disorders,Substance-Related & Addictive Disorders,Bipolar Disorders,Generalized Anxiety Disorder,Restrictive/Compensatory Disorders,Bipolar 2 Disorder,Paranoid Personality Disorder,Avoidant Personality Disorder
6436,i'm so hungry,"tw not sure what for but i'm not feeling great and it might make someone feel a type of way to read this. i've been eating at my bmr for just over a week after severe restriction because it was getting a bit scary with the heart symptoms. i've had horrible stomach issues and lost more scale weight than should be physically possible given the defecit i'm in. i haven't felt excessively hungry, it's been really hard to eat the food. that is until today. my body decided it suddenly needed everything, all the food. i powered through all day, through the dizziness, brain fog and hunger. i was sitting on my sofa, about to go to bed, feeling some of the deepest hunger i've ever felt. i stupidly decided to eat a protein bar hoping to abate the hunger enough to go to sleep but it had the opposite effect. i feel worse, more hungry than before so it wasn't even worth going over my limit and i wish i could reach into my stomach and pull it back out. i can't purge, emetophobia. i'm going to step on the scale tomorrow and be disappointed, i can feel myself spiralling back into full restriction. at least then i'm just numb. i'm not even uw, just scraping around the low end of healthy. i don't even deserve the food.",Eating Disorders,Personality Disorders,Schizophrenia Spectrum & Psychotic Disorders,Restrictive/Compensatory Disorders,Generalized Anxiety Disorder,Substance Use Disorders,Anorexia Nervosa,Schizoid Personality Disorder,Antisocial Personality Disorder
23037,love literally does not exist and if it does it's always one sided,"i can love, i have loved, i am an extremely loving person. i'm smart, funny, slim and objectively attractive. yet nobody cares. nobody ever tries. everyone else is happy. feels like almost everyone else my age is in relationships. i'm 19. i'm treated like a body. they just want to get off. i might as well just be a plastic blow up doll. dw i don't let them treat me that way i don't accept that shit. i just don't understand why i'm never enough. no matter what. yet all the less attractive less smart (and often rude) girls have bfs literally what am i even doing wrong?? i just get creepy stares. never approached. just get creeped on. all the damn time. i never feel safe on my own as a woman. all i have ever fucking wanted in my entire life is for somebody to love me. that is all i have ever wanted. here i am saving myself for someone special and everyone else has experience. why do i fucking bother. i feel like a loser. people don't love like i love. people don't care like i care. when i love someone i give them everything. absolutely everything. no one has ever done the same for me. i'm sick of it.",Mood Disorders,Trauma & Stressor-Related Disorders,Neurodevelopmental Disorders,Depressive Disorders,Generalized Anxiety Disorder,Insomnia Spectrum,Major Depressive Disorder,Bipolar 1 Disorder,Post-Traumatic Stress Disorder (Ptsd)
13700,rls megathread the ultimate summary of all techniques and treatments,"hello everyone, i'm french, and like all of you here, i also suffer from rls. thank you for all your testimonials i read them with great interest. this sub is much more informative than french subs or forums. i wanted to know if it would be possible to create a thread summarizing all the techniques or treatments that help you or have even made your symptoms disappear? as for me, i take 2400mg of gabapentin 0.5mg of xanax every night. i feel like my symptoms come in cycles some nights i move less than others, and i can t explain why. i have the feeling it s strongly linked to my diet, but i don't know which foods or molecules trigger rls i d like to try medical cannabis or cbd (i ve already tried cbd drops, but they didn t do anything for me ). in any case, if we could compile different treatmentstechniques (with precise dosages and timing) in the comments of this thread, i think it would be really helpful for everyone.",Sleep Disorders,Substance-Related & Addictive Disorders,Anxiety Disorders,Insomnia Spectrum,Psychotic Disorders,Bipolar Disorders,Restless Legs Syndrome,Bulimia Nervosa,Attention-Deficit/Hyperactivity Disorder (Adhd)
14158,sensory sensitivites after a manic episode,"i've been really jumpy since my last manic episode. i had a suspicion it was bipolar. i looked around and it seems to be a thing. have any of you experienced them? which senses, and for how long? i'm still in the jumpy phase. my partner opened the door to the dark room i was in and the light hurt to the point where i covered my eyes and asked them to close the door. i was snippy, but in my defense, that was a pain response. i jump at sounds too, but my other senses seem unaffected. i'm autistic, and my biggest sensitivity is already light, but it wouldn't have hurt normally, just felt annoying. holy hell, did i ever feel like a vampire this morning. curious about what other people have experienced related to this. i always like to hear people's anecdotes it helps me better understand the disorder by adding a human element to contrast with clinical research",Mood Disorders,Obsessive-Compulsive & Related Disorders,Neurodevelopmental Disorders,Bipolar Disorders,Generalized Anxiety Disorder,Cluster C (Anxious/Fearful),Bipolar 1 Disorder,Post-Traumatic Stress Disorder (Ptsd),Insomnia
11170,methadone startup,"doc and i finally decided to start methadone after everything else finally failed for me. 2.5 as i taper gabapentin and cannabis (almost at zero now) and green light for 5mg. so, question... i start feeling crappy in the afternoon, need to nap badly. anyone have a similar experience? when can i expect this to normalize, if at all and reach a steady state?",Sleep Disorders,Personality Disorders,Neurodevelopmental Disorders,Insomnia Spectrum,Ocd Spectrum,Panic Disorders,Restless Legs Syndrome,Schizoid Personality Disorder,Schizoaffective Disorder
274,4 hours and 11 minutes after midnight,"a poem about my experience with insomnia. 4 hours and 11 minutes have elapsed since midnight, all awake. it is not by choice i stay awake but choice or not i am here. unconsciously, continuously i suffer awake unable to rest even through rest i rest not easy for the morning brings uncertainty to wakefull rest. i yearn for sleep unable to choose when i may slip away to dreams untold. but dream i do not. dark thoughtless nights await me as my brain tries its best to recover through this endless cycle. when sleep is achieved it is not my choice, but chooses by force my body does, eventually i do sleep. sleep i do deeper than most but most struggle not to sleep sweet slumber. awake i lay perpetually perplexed at the painful reality that ponders sweet pain. i do not desire sleep, i yearn for it hoping for one restful night i may rest my eyes to wake with the ability to do it again. unfortunately for me that is not the case so here i lay loft looking at the ceiling in the low light suffering. it is not by choice i suffer alone, solemnly sought after sleep so desperately, i hope one day i may suffer no more.",Sleep Disorders,Mood Disorders,Anxiety Disorders,Insomnia Spectrum,Depressive Disorders,Cluster C (Anxious/Fearful),Insomnia,Post-Traumatic Stress Disorder (Ptsd),Attention-Deficit/Hyperactivity Disorder (Adhd)
2911,different masking personalities,"do you guys feel like you have different personalities for different situations? it's like i become a different person that isn't me at all. i think i'm just masking to behave how i think i should but i don't feel myself doing it in the momenton purpose. it's usually not until after that i'm like what the fuck was that. sometimes i'll snap back into what i believe is me and realize it, i suspect my brain gets overloaded and i just cant mask anymore. i think it affects my memories too. my memory is already bad tho so its hard to say.",Personality Disorders,Sleep Disorders,Eating Disorders,Cluster A (Odd/Eccentric),Phobias,Cluster C (Anxious/Fearful),Schizoid Personality Disorder,Antisocial Personality Disorder,Narcissistic Personality Disorder
11183,mid march is my absolute worst time of the year for this disorder.,"for some people it s earlier in the winter but for me it s the absolute worst this time of year. i alway hope each march will be better than the one before it, but alas it s the same and maybe worse? then i often wonder how in earth i made it through the last year and the year before etc. as each day passes i know i am closer to some feeling myself again but it sure is agonizing just waiting until i am happy.",Mood Disorders,Anxiety Disorders,Sleep Disorders,Depressive Disorders,Bipolar Disorders,Ocd Spectrum,Seasonal Affective Disorder,Sleep Apnea,Anorexia Nervosa
1602,any weird remedies?,"i work in an office environment where i sit a lot. this isn't great, but i make it work for the most part. before you judge me, this works wonders for me personally. i have several people i trust who i allow to slap me on the forehead when they see me starting to ""narc"" and the sharp shock of it brings me back into the room almost instantly. do you guys have any unconventional means of getting yourself out of a ""narc""?",Sleep Disorders,Personality Disorders,Substance-Related & Addictive Disorders,Insomnia Spectrum,Cluster B (Dramatic/Emotional),Bipolar Disorders,Narcolepsy,Panic Disorder,Bulimia Nervosa
21634,is judging other people an ocpd trait?,"i don't have ocpd myself but have a sibling that does. they have the perfectionism and rigid standards issue, which is fine. however, they also judge me and almost everyone they know, as if they are grading me and everyone else in what we do, what decisions we make, how we live our lives, etc. is this an ocpd thing, or that's just them? i'm trying to have a lot of compassion for my sibling. i accept them for who they are and i know it's not their fault and they are struggling. however, i'm very very hurt by the labels, the namecalling and the intolerance to any different way of life from their own. they look down on me and view me as morally inferior. i live and let live but they are hyper focused on my life and my actions (which have nothing to do with them), judging and labeling what i do. they do this to our whole family. is this a norm in ocpd? their ""special interest"" is religion, so they feel justified in their judgement because god is on their side (they are extremely religious, super conservative) and if i don't follow their personal rules in my own private life, then i'm wrong. they are also extremely riskaverse and avoid making decisions (so they can avoid being wrong, avoid failures) and anytime i show some bravery and make a decision, i get labeled ""reckless"" and ""impulsive"". i've been called a lot of names...",Personality Disorders,Neurodevelopmental Disorders,Anxiety Disorders,Cluster C (Anxious/Fearful),Phobias,Autism Spectrum Disorders,Obsessive-Compulsive Personality Disorder,Delusional Disorder,Adjustment Disorder
12868,ptsd and hypnotherapy,"hey there. lately i've found myself speaking to a lot of people living with post traumatic stress about my work. with that uptick in query, i wanted to make a full post to help anyone with questions. for those who do not know me, i am a clinical hypnotherapist, author, speaker and myself also have ptsd. to begin, i need to make something clear not all hypnotherapists are the same. for example, not all are qualified to work with trauma and the like. i possess a post graduate degree in clinical hypnotherapy on average in my field, i'm a bit overeducated. it does give me the toolkit to work with more severe or serious issues. so consider this a disclaimer that anything i say here is not a broad description. in the name of not writing a novel, i want to answer two questions what exactly is hypnotherapy and how does it relate to pstd? the hypnotic state is not some metaphysical voodoo. it is another word for the theta brainwave pattern, what is essentially your brains programming state. hypnosistrance can be observed, demonstrated in controlled conditions and the observations in doing so will be predictable. outside of deep trance, it is not an unaware state. in the hands of an educated professional, it is very safe. i say that hypnosis is simply advanced communication, or essentially just communication that integrates the languages of the subconscious mind.b with ptsd, it allows for some very beneficial things. for one, i will never ask a client to speak about the trauma itself in detail. i focus on the feelings, current mindsets and difficulties. personally, i am focused on progress and i try to make sure each session i have with someone gets forward motion i work in stages initially. i work on my gently examining root causes, physical relations a life impacts and in the process of doing this over the first, i give tools to help manage living with this such as controlling panic attacks, creating calm and more. it feels like such a simplification, but as i said, were avoiding a novel here. if you have anything you'd like to know, please ask. have a. wonderful day",Trauma & Stressor-Related Disorders,Mood Disorders,Eating Disorders,Ptsd Spectrum,Phobias,Depressive Disorders,Post-Traumatic Stress Disorder (Ptsd),Agoraphobia,Major Depressive Disorder
17701,fp can get snippyirritable sometimes and need help avoiding panic attacks,"pretty much what the title says. when my fp is burnt out or overwhelmed by anything, he gets kind of snippy. he never takes it out on me but its easy to tell and you can tell with his voice he is irritated but trying not to sound irritated. he will also say like ""sorry if i sound a little snippy im really tired"". frankly he handles it as best as possible. i just also feel like im about to get a panic attack and am actively trying to hold it off. i have panic disorder and im fairly good at managing it now. this is the main exception as it is fp related and a situation that does not happen often. the 333 rule does nothing for me at all. i focus on breathing, i get ice packs, and take my panic attack meds. it helps but its not bc im overwhelmed or anything its bc of the situation. does anyone have advice on anything that helps you? the main reason im worried is bc when i have panic attacks there is no way of hiding them. it looks like a physical medical emergency so its not a thing where im like ""ill go to the bathroom and ride it out"" or anything",Mood Disorders,Trauma & Stressor-Related Disorders,Anxiety Disorders,Bipolar Disorders,Autism Spectrum Disorders,Cluster C (Anxious/Fearful),Bipolar 1 Disorder,Schizoaffective Disorder,Delusional Disorder
21146,i m so depressed i feel like i m dying.,"lately i ve been feeling really, really depressed as the title says i genuinely feel like i m trapped inside my head and it feels like i m dying. for some background information growing up anytime i did something wrong my parents would tell me things like that s why nobody will ever love you and do you really think those people (my friends) actually care about you? i try to keep myself as happy as possible because when i get sad, i don t get sad, i spiral into this deep feeling of worthlessness. this little voice starts to tell me nobody loves me, if i try to tell myself hey that s unrealistic it only works for a moment. every. single. thing. reinforces that thought. partner not responding? they don t love you. someone compliments me? they re saying that so you don t hurt yourself because they don t wanna feel guilty when you do it. nothing good can happen without my brain telling me i m unlovable in some way. when it gets really bad i start to get angry at everyone in my life for lying to me, they don t wanna see me, they just feel bad for me. they don t love me they re lying. then i start to isolate myself. the feeling consumes me, i can t find a way out, i ve gone to therapy and i thought being diagnosed and treated for adhd would help but no. this is a recurring theme for me. it s been happening ever since i can remember. but being in a relationship has made it 1000x worse. it s making it feel so much more unbearable because that voice just keeps telling me they re cheating on you, this is intuition not depression and i genuinely don t know what to do. i hope someone at least gives this a read, i don t know what i m looking for posting this. i ve never told anyone in my life this is how i feel. i think i just need to get a diary.",Mood Disorders,Obsessive-Compulsive & Related Disorders,Personality Disorders,Depressive Disorders,Phobias,Cluster A (Odd/Eccentric),Major Depressive Disorder,Body Dysmorphic Disorder,Avoidant Personality Disorder
20297,i got diagnosed with schizoid personality disorder. not quite sure,recently i was diagnosed with both adhd (combined) and schizoid personality disorder. was actually suspecting autism but spd makes more sense. however researching it more i have more doubts. kinda funny i was formerly diagnosed first and am now researching it online and don t know. because i never heard of it to be honest and some traits match but alot seem extreme for me personally. because i tend to be a loner and avoidant emotionally and with relationships and romance but i still desire it deeply idk. i just don t know. also have major depressive disorder and generalized anxiety disorder if that helps.,Personality Disorders,Neurodevelopmental Disorders,Schizophrenia Spectrum & Psychotic Disorders,Cluster A (Odd/Eccentric),Cluster C (Anxious/Fearful),Generalized Anxiety Disorder,Schizoid Personality Disorder,Narcissistic Personality Disorder,Social Anxiety Disorder
1426,anxiety over a new relationship,"hi nb 17 here. i found out a month ago i have a crush on my best friend. and he likes me too. after a week i started having severe anxiety and panic attacks. freaking out terribly. overthinking if i really do like him. he stayed with me last weekend and it was so amazing and helped me a lot. (long distance by 2 hours)once he left on monday everything went down hill. i was in spirals. my body physically stopped working and i can t eat because of how stressed i am. i m communicating how i feel to him and he s there every step of the way. which i love. for some reason i feel jealous at the thought of him with someone else, loving someone else, finding someone else, even though i m unsure of my feelings and emotions. i hate it a lot. and it makes me wonder if i truly truly love him that much that i get jealous. and i m not a jealous person normally. but what makes me wonder is if this is from my past relationship 4 years ago i got traumatized from, i got gaslit, mentally abused, lied to, shamed, took blamed for things. and i loved my ex so much. i had rose glasses on without knowing. i struggle with knowing if i want a relationship with him, or to be best friends or nothing. but it hurts knowing if we were nothing. i talked with my therapist and she said i was having ptsd reactions to my new relationship, from my old one. cause my heart is filled with anxtiey and physical pain making me over think if i even love my current boyfriend. making me think i m making a mistake. but. it feels right too. i want to be loved. he s the sweetest thing in the world and i feel so numb when he loves me, i wanna open up and let him in but i m so scared. i want to try. that s what i want. i ve been like this for a week. stressed and not eating, palpitations in my chest from anxiety, bed rotting, struggling to shower. i just wanna know what could possibly be going on. if anyone could give me an anwser or some advice. it would be great.",Anxiety Disorders,Schizophrenia Spectrum & Psychotic Disorders,Neurodevelopmental Disorders,Generalized Anxiety Disorder,Restrictive/Compensatory Disorders,Cluster C (Anxious/Fearful),Generalized Anxiety Disorder (Gad),Restless Legs Syndrome,Schizotypal Personality Disorder
12764,progress.,"today, for the first time in a year, i can walk to my bed without stumbling and tripping over the mountains of trash around the path i made. yesterday, i slept in a bed not overtaken with trash. tomorrow, i start the final part of my decluttering before a major deep clean happens. i'm so happy. i pulled myself out. i'm throwing things away.",Obsessive-Compulsive & Related Disorders,Substance-Related & Addictive Disorders,Trauma & Stressor-Related Disorders,Ocd Spectrum,Phobias,Panic Disorders,Hoarding Disorder,Anorexia Nervosa,Autism Spectrum Disorder (Asd)
