id,Title,Body,Category,Category_2,Category_3,Subcategory,Subcategory_2,Subcategory_3,SpecificDisorder,SpecificDisorder_2,SpecificDisorder_3
17550,first sad lamp feels harsh uncomfortable,"after years of people recommending it, i finally got a sad lamp for christmas (or as i like to call them happy lamps). it's huge firstly, very hard to find space. and it says i'm supposed to be within 16 inches of the things. it's a very bright, very white, harsh fluorescent light. right now i have it maybe a foot behind and a bit left of my laptop screen as i'm working. do i just get used to it? should i position it more off to the side. i'm very affected by lack of sun in the winter, and this year has been super cloudy on top of it (maybe 3 or 4 truly sunny days here since november), so i'd like to try this solution out and see the results... i understand i should have some ambient lighting on in the room as well so it's less of a contrast... ironically i generally dont' like bright lights in the morning, especially in winter as i find them jarring. am i trying to have my cake and eat it, too? thanks",Mood Disorders,Eating Disorders,Anxiety Disorders,Depressive Disorders,Restrictive/Compensatory Disorders,Autism Spectrum Disorders,Seasonal Affective Disorder,Autism Spectrum Disorder (Asd),Sleep Apnea
4752,how does your panic attack starts?,"hi guys i was born with a coronary heart disease. this was repaired when i was 9. i'm being checked every year by a cardiologist. at the moment i'm 36 and still stable. but a year ago i suddenly starting to have panic attacks. it always starts with a annoying feeling on the left side of my chest or between my shoulderblades. then i get dizzy and think that i'm going to die. i'm 100% sure that there is no problem with my heart or something else because in the last year i have been checked by 8 different cardiologists and had an echo, mri, ctscan. all looking good. also i'm constantly struggling with death and what is after death. how does your panic attack starts, plus how did you get rid of these annoying episodes?",Anxiety Disorders,Obsessive-Compulsive & Related Disorders,Trauma & Stressor-Related Disorders,Panic Disorders,Ocd Spectrum,Cluster B (Dramatic/Emotional),Panic Disorder,Insomnia,Adjustment Disorder
2501,dating someone with adhd,"has anyone had a really good experience dating someone else that is also diagnosed with adhd, or has it been a bad experience? one time i met another girl with adhd we just immediately hit it off. didnt need to explain things, didn't need to apologize for eccentricities, etc. like we saw connections immediately and didn't have to talk so much. it's like conversations just flowed so fast and we were limitless. we broke up because she got back with her exhusband who was really rich. (so that really sucked, but i guess thats miami chicks for you.)",Neurodevelopmental Disorders,Sleep Disorders,Eating Disorders,Adhd,Generalized Anxiety Disorder,Psychotic Disorders,Attention-Deficit/Hyperactivity Disorder (Adhd),Adjustment Disorder,Body Dysmorphic Disorder
4084,how did you get stable enough to keep on living ?,"i (30 f) have dealt with overwhelming anxiety and rapid mood swings for now half of my life. can't remember how it was truly like before, i hate this. cyclothymia was discussed with my psychiatrist in december. back then, it had been a year on antidepressant which only helped on panicanxiety attacks. therefore, we tried abilify, which was a disaster. at the same period, we stopped the antidepressant which led me to be hospitalized beginning of january because i wanted to end it all. second hospitalisation in two years, for the same reason. now i'm back on antidepressant antipsychotic (the latter helps with anxiety attacks). since i can't stop the rapid cycling from happening, i'm scared of myself and what i can do when my mood is really low. how did you get stable enough to keep on living ? i really want to live and grow old. don't know how since i've seen (too) many psychiatrist psychologist, tried different medications and am tired of dreading the next mood swings... (i can change extremely rapidly from an hour to the next within the same day)",Mood Disorders,Anxiety Disorders,Sleep Disorders,Bipolar Disorders,Panic Disorders,Cluster A (Odd/Eccentric),Cyclothymic Disorder,Post-Traumatic Stress Disorder (Ptsd),Schizoaffective Disorder
21025,i m not allowed to run anymore,"i'm actually about to cry right now. my doctor said my heart rate and blood pressure are too low for cardio and i know my mother will enforce this. i'm not even that underweight, i look normal, just fit. and now i'm crying i love running and working out so so much and now i can't. sorry i know this has no purpose i'm just ranting because i'm so sad and i know the people i know won't understand.",Eating Disorders,Obsessive-Compulsive & Related Disorders,Mood Disorders,Restrictive/Compensatory Disorders,Ocd Spectrum,Ptsd Spectrum,Anorexia Nervosa,Antisocial Personality Disorder,Insomnia
15585,crying myself to sleep because i worked a 40 hour week,"i have always had to work 2 jobs to keep myself afloat and manage well unless i get above like 30 hours for the month of february i was only working one job while i looked for a new morning job and i was so healthy and doing so well. my moods were in control and i was able to take care of myself and my home. i started a new job at the start of this month and they ve been increasingly more hours and there s no semblance of a routine. everything is falling apart, my moods are all over the place, my apartment is falling apart, i m not taking care of myself. i cant do this but i cant not do it because i can barely afford to live as is. how do you guys deal with having to work full time? i don t know what to do i m just sobbing uncontrollably and feeling so hopeless.",Mood Disorders,Eating Disorders,Obsessive-Compulsive & Related Disorders,Bipolar Disorders,Adhd,Psychotic Disorders,Bipolar 1 Disorder,Panic Disorder,Persistent Depressive Disorder (Dysthymia)
22334,just got diagnosed with ptsd after being an anxious mess for most of my life is it supposed to feel worse before it gets better?,"what i mean is, ever since i explained the events to my therapist out loud, i have been thinking about it even more than usual. while before, i d think about it whenever i got into a bedwhen falling asleep, occasionally having flashbacks when certain subjects are brought up (morbid conversations or dark films), and having dreams about it every month or so, now it seems like i m thinking about it all day. thinking about the words coming out of my mouth. thinking about another persons reaction to it (especially his expression). noticing how fucked up it all truly was. i m really knocking myself and feeling a ton of regret about the situation. i m so angry and ashamed. can anyone relate? is this common? will this help me feel closure eventually??",Trauma & Stressor-Related Disorders,Personality Disorders,Schizophrenia Spectrum & Psychotic Disorders,Ptsd Spectrum,Autism Spectrum Disorders,Cluster C (Anxious/Fearful),Post-Traumatic Stress Disorder (Ptsd),Restless Legs Syndrome,Obsessive-Compulsive Personality Disorder
5754,i think i m dying,"title is explanatory. intense total insomnia happened overnight. last time i slept i slept for 11 hours, in fact i had major issues with hypersomnia throughout my entire life, as well all vivid dreams and hypnagogic hallucinations for the past few months. as of writing ive been up for 40 hours and i cannot sleep at all. i just sit in the stage right before sleep and nothing happens. i m 100% convinced im dying. all the sleep aids that once worked now do nothing. i can only pace and pace until i mentally deteriorate and die. sorry for the sorrowful words, but its reality now.",Sleep Disorders,Obsessive-Compulsive & Related Disorders,Schizophrenia Spectrum & Psychotic Disorders,Insomnia Spectrum,Generalized Anxiety Disorder,Bipolar Disorders,Insomnia,Cyclothymic Disorder,Antisocial Personality Disorder
12876,ptsd flashbacksspiraling medical trauma,"back story in 2018 i was originally told i had a uti even though i was passing kidney stones. urgent care said no it's not stones it's uti, take these antibiotics. so i did. week later still feeling sick. i called a urologist they take an xray, i have a bunch of stones in my ureter by my bladder, dr says i can pass them. next day i wake up septic and very sick. called urologist they told me to come in immediately. had to have emergency surgery to remove a blocked stone and they pulled out that stone and the pressure from the infection just pushed out way more stones. spent like 4 days in the hospital hooked to ivs and such. well 2024 my health anxiety started getting really bad. and then just recently i found out i had kidneystones again and needed them removed via surgery. i have already been struggling hard with my anxiety and panic attacks started popping back up. i had surgery monday and was too scared to sleep monday night. tuesday night i got some sleep. wednesday i removed the kidney stent and now have been having blood in urine and such that the dr says is normal but it's freaking me out. ive been awake off and on all night, i am shaking. i close my eyes and i see things like ivs, or start thinking bad thoughts like ""what if this is happening"" or ""what if that"" i have daily ativan to take since i've been in full blown panic for awhile and i've already taken 2 since 3am just trying to shut my brain up. im legit scared like everything bad is happening again and i can't get people to understand this.",Trauma & Stressor-Related Disorders,Anxiety Disorders,Obsessive-Compulsive & Related Disorders,Ptsd Spectrum,Cluster A (Odd/Eccentric),Restrictive/Compensatory Disorders,Post-Traumatic Stress Disorder (Ptsd),Insomnia,Panic Disorder
22208,join agoraphobia haven a safe and supportive discord space,"hi everyone if you re looking for a welcoming and safe place to connect with others who understand agoraphobia and anxiety, i d love to invite you to my discord server, agoraphobia haven. created in august 2024, this server is a judgmentfree space where you can share your experiences, find resources, and build connections. what we offer emotional support daily activities like questions, celebrations of progress and calls to help each other go outside safe spaces for chats and voice calls helpful resources for anxiety and agoraphobia everyone with agoraphobia is welcome join us here httpsdiscord.ggvgqmqsjzdz you don t have to face this alone. let s support and help each other",Anxiety Disorders,Obsessive-Compulsive & Related Disorders,Neurodevelopmental Disorders,Phobias,Cluster A (Odd/Eccentric),Restrictive/Compensatory Disorders,Agoraphobia,Paranoid Personality Disorder,Avoidant Personality Disorder
14985,can't sleep after moving,"hey, all i moved into a new place with my partner two weeks ago today, and i haven't gotten more than 5 hours of sleep since the move i fall asleep just fine (usually around 11pm or so) but i wake up at 3 or 4 and cannot fall back asleep. some nights have been even more restless. it definitely seems like a hyperarousal problem stress from the move, stress about moving in with a partner, new environment, etc but i guess i'm starting to get panicky that it's not getting better. in fact, it feels like it's getting worse. i got a diagnosis of ptsd in 2017 and had terrible insomnia for probably about a year, same issue could always fall asleep, but woke up in the middle of the night with my mind racing. i know i'm preaching to the choir here, but i felt like i was losing my mind, and it affected all of my relationships and my work. i'm really scared of going back to that place and i think it's contributing to my stress. i can feel myself starting to associate our new room with really negative feelings. it's only been two weeks, so i know that there's more that i could try, but i do have good sleep hygiene (stopped using screens 3060 minutes before bed and just read instead, i don't nap during the day, i don't do anything in our bed except sleep, i go to bed at about the same time every evening), we have great blackout curtains, i've been trying melatonin, i try meditationcounting backwards from 1,000 by 3's when i wake up, and if that doesn't help, i try to read for awhile or put on a podcast so at i can at least distract myself from the stressfrustration or avoid feeling so lonely. my partner was staying at my place like 5 or 6 nights a week before we moved in together and i never had a problem sleeping with him before, but now it's like every movement or noise he makes is 100x more disruptive. i guess i'm looking to see if anyone else has experienced this before and maybe has any encouraging words? i'm also open to advice. i woke up today at 330, laid there for half an hour, and just started crying when i thought about having to go to work it's really taking a toll. thanks in advance for any thoughts you can share.",Sleep Disorders,Mood Disorders,Anxiety Disorders,Insomnia Spectrum,Generalized Anxiety Disorder,Cluster A (Odd/Eccentric),Insomnia,Antisocial Personality Disorder,Seasonal Affective Disorder
19895,i failed,guys due to my anxiety disorder issues i was not able to study well in class 11th and unfortunately failed .i am feeling like i have failed in life .i am not able to make eye which those who know that i failed .i am feeling like this is such a shameful that i failed in school.my self esteem is going down.,Mood Disorders,Personality Disorders,Eating Disorders,Depressive Disorders,Cluster A (Odd/Eccentric),Substance Use Disorders,Major Depressive Disorder,Cannabis Use Disorder,Anorexia Nervosa
16134,does it ever get better?,"im 20 and ever since i got into college my social anxiety s been a nightmare. i can barely talk to my colleagues. i don t really have any friends, and i can barely talk to people at work. i just can t do it anymore, i feel like i m wasting my youth, i wanna connect with people so bad but it s gotten to the point where i subconsciously can t. i m super demoralized, what should i do? will it ever get better?",Anxiety Disorders,Schizophrenia Spectrum & Psychotic Disorders,Substance-Related & Addictive Disorders,Phobias,Cluster A (Odd/Eccentric),Autism Spectrum Disorders,Social Anxiety Disorder,Binge-Eating Disorder,Adjustment Disorder
19582,"i consumed cannabis six days ago, and after two days, i started experiencing serious brain fog.","it's been over six days since i consumed cannabis for the first time in my life. after consuming it, i accidentally hit my head hard against my friend's head, and it still hurts even now. we were at a party when it happened. now, i'm feeling extremely paranoid and regretting taking it because i've been experiencing serious brain fog since two days after consuming it. i don't know what to do. please help and advise me on how to reduce brain fog and get back to normal. also, my head hurts whenever i bend down.",Substance-Related & Addictive Disorders,Eating Disorders,Schizophrenia Spectrum & Psychotic Disorders,Substance Use Disorders,Autism Spectrum Disorders,Cluster C (Anxious/Fearful),Cannabis Use Disorder,Paranoid Personality Disorder,Histrionic Personality Disorder
18500,has anyone gone from chronically suicidal to reliably functional?,"i've been chronically suicidal for about seven years now. but, in hindsight i think i've always had dysthymia, only difference was that i used to think i'd find a way to deal with it. even as a little kid i felt blah most of the time. my parents would tell me to fake my expression when opening my birthday presents so people didn't think i hated everything i got. i never felt happy to be alive, the thought of dying young never bothered me. i just figured that as a kid i didn't have that much control over my life, and maybe when i got older and had control i'd find something worth living for. about seven years ago, after achieving basically what i had planned on, i realized i was still just as empty as ever, and ever since i've been chronically suicidal, and made three attempts (got pretty close with the last one). i've been in treatment for about six years now, been to therapy with multiple therapists i liked, and been through a bunch of medications, (full treatment dose for the appropriate amount of time because i mostly don't experience negative side effects) but nothing's really had much of an effect. the closest i've come is with the treatment i've been doing since i got out of the hospital after the last attempt a year ago. (maximum dosage of a sari, maximum dosage of a tetracyclic antidepressant, a stimulant to give me energy, and a high dose of ketamine each week) it does just enough to keep me barely functioning for a while, but then i crash and aren't functioning for a few months, before returning to barely functioning. this isn't stable enough to have a normal life, or do much of anything. i had a great job after i got out of the hospital, but then i crashed so i couldn't keep it. i can't go to school because i crash part way through the semester. i don't know what to do with my life. i've gone through multiple psychiatrist, and therapist because ultimately each one has said i don't know what else to try. from my research it looks like maybe i could try a type of brain surgery. but my primary care doctor and psychiatrist have said they don't know how to go about getting that approved by insurance, or who to refer me to. and honestly, i'm a bit scared. because if this doesn't work, all of us will be out of ideas. i've been trying to accept the idea that the rest of my life might be nothing more than jumping from one distraction to the next between episodes of deep suicidal depression, but if possible i'd like more from life. has anyone found a way to come back from this? what did you have to do? the surgery i'm referring to is deep brain stimulation. i also haven't tried ect, despite it being recommended multiple times because i've interacted with three people who tried that and all of them had significant cognitive impairment. i've worked as an it tech, computers and philosophy are the closest thing i have to a passion. i don't want to lose those. from what i've read it sounds like significant cognitive impairment is much rarer for deep brain stimulation. i don't even qualify to try most experimental medications because they say i've failed too many treatments.",Mood Disorders,Neurodevelopmental Disorders,Substance-Related & Addictive Disorders,Depressive Disorders,Ocd Spectrum,Autism Spectrum Disorders,Persistent Depressive Disorder (Dysthymia),Bipolar 1 Disorder,Obsessive-Compulsive Disorder
17666,forced pattern recognition,"i'm not sure if there's a better word for this but i was listening to this random podcast and something clicked for me. most thinkers or system developers or ""influential historical figures "" be they agents of ""evil"" or ""good"", regardless of which, seem to arrive and arise at the specific time they are needed. as though guided by a specific will, which i guess is besides the point to mention but whatever. maybe it's relevant. there has to be a person almost as a vessel for the information required to ""rise to power "" in a nietzchian sense, or as he sort of played with at the end of his life ""the will to information"", in his discarded notes (real thing check it out). placing that person, is likely an act of nature and genetic luck though we like to romanticize it as destiny, the evidence leans strongly toward genetic determism.. but my rambling point is that these system builders or agents of change and influence all meet a substantial resistance in their environment which requires attention and problem solving. a psychologically stable individual will look at these problems if they are apt to deal with the information and consistently build on it as though some form of ""genius ""however, what if a person is subjected to substantial impairments in childhood? then pattern recognition, the ""problem recognition "", begins at a young age. the will to power or whatever it is, goes through or around the obstructions, almost always a combination of abusive and neglectful caregivers and neglectful environment. the days become years and this pattern recognition grows just as an economics genius or math genius would except in this case it's highly specialized to certain environmental cues that later in life and not often present (though this does explain why people try to control their trauma by reinforcing it) there's debate about whether this program, redundant and negative often in its outcomes, can be resolved at any or all levels , especially i wonder about biological levels, in other words if one can become conscious or as conscious as possible of their own mistplaced and almost foundational to self and existence pattern recognition their ""paranoia"", that they can also ""cure"" or experience full biological health, considering that often people with schizo spectrum disorders went through key developmental years with those traits already ""dormant"", so to speak. i am left to wonder if the information and pattern recognition itself is just a source of continuous suffering one can cut themselves on over and over, a way to soothe ones self to sleep at night or an impossibly tangled mess that will always impede spirit and the ability to breathe and feel connected to reality. my belief is that the physiological damage is permanent and we can only work with the symptoms of it, reducing them and improving positive factors, with significant back and forth in quality of life due to the root bioglical ""corruption "", that isn't functioning correctly.",Personality Disorders,Eating Disorders,Mood Disorders,Cluster A (Odd/Eccentric),Phobias,Cluster B (Dramatic/Emotional),Schizotypal Personality Disorder,Hoarding Disorder,Restless Legs Syndrome
23043,love waking up sober,"happy saturday gang with so many people posting about how miserable they are trying to be sober and how difficult it it is (and it truly is), i just wanted to share how unbelievably better my life has been since getting clean. the journey continues every day but i am so grateful to be living life and not letting it pass me by as i destroy myself. if you are working on being sober, keep going. and if you have a lapse, get back up and try again. you will be happier in general and those who really care about you will see the real you.",Substance-Related & Addictive Disorders,Mood Disorders,Schizophrenia Spectrum & Psychotic Disorders,Substance Use Disorders,Ocd Spectrum,Restrictive/Compensatory Disorders,Alcohol Use Disorder,Bipolar 2 Disorder,Schizotypal Personality Disorder
17355,feeling stuck and overwhelmed while trying to learn,"i don t know where i m heading i want to study something related to my work that will truly benefit me. for the past six months or more, i ve been putting in effort, and while i ve made some progress, it doesn t match the effort i ve invested. i ve realized that i m stuck in a cycle of gathering too many resources, all neatly organized in an almost obsessive way, but i haven t completed any of them. when i look at what i ve truly learned, it s just the beginnings of many resources without finishing any of them. whenever i try to focus on a single resource and commit to it, i quickly feel frustrated, especially when the content feels too basic or when i don t feel like i m making substantial progress. now, i feel exhausted, unsettled, and overwhelmed. i don t know how to organize what i ve done so far, and i m scared that i won t achieve anything meaningful if this continues. another issue i m facing is that i don t feel happy with small achievements. unless i accomplish something huge in a single day, i feel dissatisfied, and unfortunately, i rarely meet this high standard. does anyone else feel like this? what am i going through, and how can i fix it?",Personality Disorders,Eating Disorders,Obsessive-Compulsive & Related Disorders,Cluster C (Anxious/Fearful),Ptsd Spectrum,Generalized Anxiety Disorder,Obsessive-Compulsive Personality Disorder,Schizoid Personality Disorder,Bulimia Nervosa
12985,question abt propranolol,"hey anxious sexcy ppl i wrote around a month ago about a panic attack i had when i took 5mg of propranolol. and then insomnia followed after (which i ve heard is very normal). i guess i m just wondering if anyone else experienced a panic attack on propranolol or if maybe it was all in my head? i ve been trying out different anxiety meds for almost a year now but also am still terrified of new ones. does this medication actually help people? with panic, i mean? it s getting increasingly harder to leave the house (apart from when i m in uni, i m fine there for some reason lol). i m willing to try it again, i just feel like i need some advice. have a great day",Anxiety Disorders,Substance-Related & Addictive Disorders,Obsessive-Compulsive & Related Disorders,Panic Disorders,Adhd,Ocd Spectrum,Panic Disorder,Paranoid Personality Disorder,Sleep Apnea
